{
  "schema_version": 1,
  "glossary_version": "0.1.0",
  "source_issue": "PenniLogic/docs#84",
  "status": "provisional",
  "terms": [
    {
      "id": "term.transaction",
      "preferred_label": "transaction",
      "definition": "A single movement of money into or out of one of your accounts, recorded once even when it is seen in more than one place.",
      "status": "provisional",
      "surfaces": [
        "android",
        "web",
        "admin",
        "contracts",
        "support"
      ],
      "forbidden_aliases": [
        "txn"
      ],
      "contract_field_names": [],
      "comprehension": {
        "required": false,
        "evidence_ref": null
      },
      "owner": "content"
    },
    {
      "id": "term.debt",
      "preferred_label": "debt",
      "definition": "Money you owe to a lender or person, with its balance, interest rate, minimum payment, term and fees.",
      "status": "provisional",
      "surfaces": [
        "android",
        "web",
        "admin",
        "contracts",
        "support"
      ],
      "forbidden_aliases": [
        "dues"
      ],
      "contract_field_names": [],
      "comprehension": {
        "required": false,
        "evidence_ref": null
      },
      "owner": "content"
    },
    {
      "id": "term.principal",
      "preferred_label": "principal",
      "definition": "The part of a debt balance that is the borrowed money itself, not interest or fees.",
      "status": "provisional",
      "surfaces": [
        "android",
        "web",
        "admin",
        "contracts",
        "support"
      ],
      "forbidden_aliases": [
        "capital owed"
      ],
      "contract_field_names": [],
      "comprehension": {
        "required": false,
        "evidence_ref": null
      },
      "owner": "content"
    },
    {
      "id": "term.interest",
      "preferred_label": "interest",
      "definition": "The cost of borrowing that a lender adds to a debt over time, set by its rate.",
      "status": "provisional",
      "surfaces": [
        "android",
        "web",
        "admin",
        "contracts",
        "support"
      ],
      "forbidden_aliases": [
        "finance charge"
      ],
      "contract_field_names": [],
      "comprehension": {
        "required": false,
        "evidence_ref": null
      },
      "owner": "content"
    },
    {
      "id": "term.minimum_payment",
      "preferred_label": "minimum payment",
      "definition": "The smallest payment a lender accepts for a debt in a billing period; paying only this usually costs more interest over time.",
      "status": "provisional",
      "surfaces": [
        "android",
        "web",
        "admin",
        "contracts",
        "support"
      ],
      "forbidden_aliases": [
        "minimum due"
      ],
      "contract_field_names": [],
      "comprehension": {
        "required": false,
        "evidence_ref": null
      },
      "owner": "content"
    },
    {
      "id": "term.apr",
      "preferred_label": "APR",
      "definition": "Annual percentage rate: the yearly interest rate a lender charges on a debt, shown as a percentage.",
      "status": "provisional",
      "surfaces": [
        "android",
        "web",
        "admin",
        "contracts",
        "support"
      ],
      "forbidden_aliases": [
        "rate of return"
      ],
      "contract_field_names": [],
      "comprehension": {
        "required": false,
        "evidence_ref": null
      },
      "owner": "content"
    },
    {
      "id": "term.payoff",
      "preferred_label": "payoff date",
      "definition": "The date a debt or all debts would be fully repaid if the shown payments continue as planned. It is a calculation, not a promise.",
      "status": "provisional",
      "surfaces": [
        "android",
        "web",
        "admin",
        "contracts",
        "support"
      ],
      "forbidden_aliases": [
        "debt-free date"
      ],
      "contract_field_names": [],
      "comprehension": {
        "required": true,
        "evidence_ref": "pending:PenniLogic/docs#66"
      },
      "owner": "content"
    },
    {
      "id": "term.available",
      "preferred_label": "available",
      "definition": "Money the app shows as free to use after known bills, reserved amounts and pending transactions; it is not a bank balance.",
      "status": "provisional",
      "surfaces": [
        "android",
        "web",
        "admin",
        "contracts",
        "support"
      ],
      "forbidden_aliases": [
        "spare cash"
      ],
      "contract_field_names": [],
      "comprehension": {
        "required": true,
        "evidence_ref": "pending:PenniLogic/docs#66"
      },
      "owner": "content"
    },
    {
      "id": "term.projected",
      "preferred_label": "projected",
      "definition": "A figure calculated from your own data and stated assumptions about the future; it can change when the data or assumptions change.",
      "status": "provisional",
      "surfaces": [
        "android",
        "web",
        "admin",
        "contracts",
        "support"
      ],
      "forbidden_aliases": [
        "predicted"
      ],
      "contract_field_names": [],
      "comprehension": {
        "required": true,
        "evidence_ref": "pending:PenniLogic/docs#66"
      },
      "owner": "content"
    },
    {
      "id": "term.stale",
      "preferred_label": "last updated",
      "definition": "Marks figures that are shown from the last saved data and may not reflect recent changes; the time of the last update is shown with them.",
      "status": "provisional",
      "surfaces": [
        "android",
        "web",
        "admin",
        "contracts",
        "support"
      ],
      "forbidden_aliases": [
        "outdated"
      ],
      "contract_field_names": [],
      "comprehension": {
        "required": false,
        "evidence_ref": null
      },
      "owner": "content"
    },
    {
      "id": "term.pending",
      "preferred_label": "pending",
      "definition": "A transaction that has started but has not settled; its final value or date can still change.",
      "status": "provisional",
      "surfaces": [
        "android",
        "web",
        "admin",
        "contracts",
        "support"
      ],
      "forbidden_aliases": [
        "uncleared"
      ],
      "contract_field_names": [],
      "comprehension": {
        "required": true,
        "evidence_ref": "pending:PenniLogic/docs#66"
      },
      "owner": "content"
    },
    {
      "id": "term.reversed",
      "preferred_label": "reversed",
      "definition": "A transaction that was cancelled or refunded after it was recorded; it is linked to the original and is not income.",
      "status": "provisional",
      "surfaces": [
        "android",
        "web",
        "admin",
        "contracts",
        "support"
      ],
      "forbidden_aliases": [
        "voided"
      ],
      "contract_field_names": [],
      "comprehension": {
        "required": true,
        "evidence_ref": "pending:PenniLogic/docs#66"
      },
      "owner": "content"
    },
    {
      "id": "term.aggregate",
      "preferred_label": "aggregate",
      "definition": "A combined total across several accounts, members or categories that does not show the individual items behind it.",
      "status": "provisional",
      "surfaces": [
        "android",
        "web",
        "admin",
        "contracts",
        "support"
      ],
      "forbidden_aliases": [
        "rollup"
      ],
      "contract_field_names": [],
      "comprehension": {
        "required": true,
        "evidence_ref": "pending:PenniLogic/docs#66"
      },
      "owner": "content"
    },
    {
      "id": "term.shared",
      "preferred_label": "shared",
      "definition": "Data one member has chosen to let another member see, category by category and person by person.",
      "status": "provisional",
      "surfaces": [
        "android",
        "web",
        "admin",
        "contracts",
        "support"
      ],
      "forbidden_aliases": [],
      "contract_field_names": [],
      "comprehension": {
        "required": false,
        "evidence_ref": null
      },
      "owner": "content"
    },
    {
      "id": "term.revoked",
      "preferred_label": "revoked",
      "definition": "Sharing or access that has been ended; the other person no longer sees the data, including earlier copies.",
      "status": "provisional",
      "surfaces": [
        "android",
        "web",
        "admin",
        "contracts",
        "support"
      ],
      "forbidden_aliases": [],
      "contract_field_names": [],
      "comprehension": {
        "required": true,
        "evidence_ref": "pending:PenniLogic/docs#66"
      },
      "owner": "content"
    },
    {
      "id": "term.refund",
      "preferred_label": "refund",
      "definition": "Money returned for an earlier payment, in full or in part; it reverses that payment and is not income.",
      "status": "provisional",
      "surfaces": [
        "android",
        "web",
        "admin",
        "contracts",
        "support"
      ],
      "forbidden_aliases": [],
      "contract_field_names": [],
      "comprehension": {
        "required": false,
        "evidence_ref": null
      },
      "owner": "content"
    },
    {
      "id": "term.consent",
      "preferred_label": "consent",
      "definition": "A choice you make to allow a specific use of your data; you can withdraw it at any time.",
      "status": "provisional",
      "surfaces": [
        "android",
        "web",
        "admin",
        "contracts",
        "support"
      ],
      "forbidden_aliases": [],
      "contract_field_names": [],
      "comprehension": {
        "required": false,
        "evidence_ref": null
      },
      "owner": "content"
    },
    {
      "id": "term.permission",
      "preferred_label": "device permission",